{
  "schema_version": "shared-caddy-bundle-provenance/v1",
  "contract_version": "shared-caddy-contract/v1",
  "helper_version": "1.0.0",
  "helper_sha256": "0000000000000000000000000000000000000000000000000000000000000000",
  "project_id": "sample-app",
  "environment": "staging",
  "deployment_id": "sample-app--staging",
  "source_repo": "https://code.example/teams/sample-app",
  "hosts": ["app.example.test", "legacy.example.test", "go.example.test"],
  "git_sha": "1111111111111111111111111111111111111111",
  "declaration_sha256": "0000000000000000000000000000000000000000000000000000000000000000",
  "fragment_sha256": "0000000000000000000000000000000000000000000000000000000000000000",
  "compose_sha256": "0000000000000000000000000000000000000000000000000000000000000000",
  "helper_requirement_sha256": "0000000000000000000000000000000000000000000000000000000000000000",
  "source": {"kind": "bundle"}
}
